{
  "version": "0.2",
  "title": "A search screen with",
  "entry": "main",
  "state": {
    "query": {
      "type": "string",
      "default": ""
    },
    "sort": {
      "type": "string",
      "default": ""
    }
  },
  "collections": {},
  "screens": [
    {
      "id": "main",
      "title": "Main Screen",
      "children": [
        {
          "kind": "heading",
          "id": "title",
          "label": "Main"
        },
        {
          "kind": "field",
          "id": "query",
          "label": "Query",
          "bind": "query"
        },
        {
          "kind": "field",
          "id": "sort",
          "label": "Sort",
          "bind": "sort"
        },
        {
          "kind": "button",
          "id": "submitBtn",
          "label": "Submit",
          "action": []
        }
      ]
    }
  ]
}