{
  "version": "0.2",
  "title": "A short-bio form wit",
  "entry": "main",
  "state": {
    "bio": {
      "type": "string",
      "default": ""
    },
    "saved": {
      "type": "boolean",
      "default": false
    }
  },
  "collections": {},
  "screens": [
    {
      "id": "main",
      "title": "Main Screen",
      "children": [
        {
          "kind": "heading",
          "id": "title",
          "label": "Main"
        },
        {
          "kind": "field",
          "id": "bio",
          "label": "Bio",
          "bind": "bio"
        },
        {
          "kind": "toggle",
          "id": "saved",
          "label": "Saved",
          "bind": "saved"
        },
        {
          "kind": "button",
          "id": "submitBtn",
          "label": "Submit",
          "action": [
            {
              "op": "set",
              "target": "saved",
              "value": true
            }
          ]
        }
      ]
    }
  ]
}