{
  "version": "0.2",
  "title": "A search screen with",
  "entry": "main",
  "state": {
    "query": {
      "type": "string",
      "default": ""
    },
    "activeChip": {
      "type": "string",
      "default": ""
    }
  },
  "collections": {
    "results": {
      "fields": {
        "id": {
          "type": "string"
        }
      },
      "seed": []
    }
  },
  "screens": [
    {
      "id": "main",
      "title": "Main Screen",
      "children": [
        {
          "kind": "heading",
          "id": "title",
          "label": "Main"
        },
        {
          "kind": "field",
          "id": "query",
          "label": "Query",
          "bind": "query"
        },
        {
          "kind": "field",
          "id": "activeChip",
          "label": "Activechip",
          "bind": "activeChip"
        },
        {
          "kind": "button",
          "id": "submitBtn",
          "label": "Submit",
          "action": []
        }
      ]
    }
  ]
}